{
  "cvd_policy": 1,
  "last_updated": "2026-08-29T08:00:00Z",
  "expires": "2027-02-28T08:00:00Z",
  "organization": {
    "name": "Example Product Vendor",
    "uri": "https://vendor.example/"
  },
  "contact": {
    "channels": [
      "mailto:security@vendor.example"
    ],
    "preferred_languages": [
      "en"
    ]
  },
  "research": {
    "posture": "report_only"
  },
  "reporting_scope": {
    "products": [
      {
        "id": "example-product",
        "state": "in",
        "name": "Example Product",
        "identifiers": [
          "pkg:npm/example-product"
        ]
      }
    ]
  },
  "reporting": {
    "requested_fields": [
      "affected_asset",
      "vulnerability_type",
      "description",
      "impact"
    ],
    "proof_of_exploitation": "requested_if_safe"
  },
  "disclosure": {
    "approach": "case_by_case"
  }
}
