{
  "cvd_policy": 1,
  "last_updated": "2026-08-29T08:00:00Z",
  "expires": "2027-02-28T08:00:00Z",
  "organization": {
    "name": "Example Organization",
    "uri": "https://example.com/"
  },
  "contact": {
    "channels": [
      "mailto:security@example.com",
      "https://example.com/security/contact"
    ],
    "preferred_languages": [
      "en",
      "de"
    ],
    "encryption": [
      "https://example.com/security/pgp-key.txt"
    ]
  },
  "research": {
    "posture": "limited",
    "statement": "Security research is welcome only under the rules below."
  },
  "reporting_scope": {
    "web": [
      {
        "id": "main-web",
        "state": "in",
        "host": "example.com",
        "schemes": [
          "https"
        ],
        "ports": [
          443
        ],
        "path_prefix": "/",
        "include_subdomains": false
      }
    ]
  },
  "testing": {
    "rules": [
      {
        "id": "automated-scan-main",
        "activity": "automated_scanning",
        "state": "permitted",
        "target_ids": [
          "main-web"
        ],
        "conditions": {
          "max_requests_per_second": 2,
          "max_concurrent_requests": 2,
          "required_user_agent_token": "security-research"
        }
      }
    ]
  },
  "reporting": {
    "requested_fields": [
      "affected_asset",
      "description",
      "reproduction_steps",
      "impact"
    ],
    "proof_of_exploitation": "not_requested"
  },
  "response_targets": {
    "acknowledgement_days": 2,
    "initial_assessment_days": 10,
    "update_interval_days": 14
  },
  "disclosure": {
    "approach": "coordinated",
    "default_days": 90
  },
  "critical_extensions": [],
  "extensions": {}
}
